{
  "schema_version": "1.0.0",
  "type": "event",
  "id": "https://example.com/events/llm-summit-2025",
  "source_url": "https://example.com/events/llm-summit-2025",
  "title": "LLM Summit 2025",
  "language": "en",
  "summary": "A one-day summit on LLM Pages and the dual-layer web.",
  "tags": ["conference", "llm", "web"],
  "last_modified": "2025-08-10T12:00:00Z",
  "content_version": "1.0.0",
  "page_checksum": "a1b2c3d4e5f6g7h8i9j0kLmNoPqRsTuVwXyZ12345=",
  "license": "CC-BY-4.0",
  "publisher": { "name": "Example Events", "url": "https://example.com" },
  "content": {
    "start": "2025-09-15T09:00:00-07:00",
    "end": "2025-09-15T17:00:00-07:00",
    "timezone": "America/Los_Angeles",
    "location": {
      "name": "Moscone Center",
      "address": "747 Howard St, San Francisco, CA",
      "lat": 37.7847,
      "lng": -122.4011,
      "url": "https://moscone.com"
    },
    "organizer": { "name": "Example Org", "url": "https://example.com" },
    "speakers": [
      { "name": "A. Jurkovic", "title": "Founder" },
      { "name": "J. Doe", "title": "CTO" }
    ],
    "capacity": 800,
    "price": 199,
    "currency": "USD",
    "registration_url": "https://example.com/events/llm-summit-2025/register",
    "tags": ["llm", "standards"],
    "description": "Talks, workshops, and panels on LLM Pages."
  }
}

